{
  "content_digest": "sha256:539387a253118ffc747c31c03b5d8d5e2fe2218e3f78b1fe9aa6edcc2d3a8129",
  "created_at": "2026-10-11T12:00:00Z",
  "document_id": "846ddbf0038440cc311ec6a81a44d2b1",
  "document_type": "activity_stream",
  "hint_version": "0.2.0",
  "payload": {
    "metrics": [],
    "observations": [
      {
        "class": "observation",
        "correlation": {
          "session_id": "02e86ff7ad1a9106cf42bc66f88bd15d"
        },
        "missing": [],
        "observation_id": "e7d8da3c330c01648766bb35dd3fe067",
        "op": "SESSION",
        "outcome": {
          "status": "success"
        },
        "precision": "exact",
        "provenance": {
          "captured_at": "2026-10-11T11:00:30Z",
          "source_event_id": "2fffcac45477382c6273fb844f3d8565",
          "transformations": [
            {
              "step": "normalize",
              "tool": "hint-cli",
              "version": "0.1.0"
            },
            {
              "step": "redact",
              "tool": "hint-cli",
              "version": "0.1.0"
            }
          ]
        },
        "source": "plugin",
        "source_id": "6e26add502e72b3782263f6399adabe6",
        "time": {
          "clock": "agent",
          "end": "2026-10-11T11:00:00Z",
          "start": "2026-10-11T11:00:00Z"
        }
      },
      {
        "class": "observation",
        "correlation": {
          "call_ref": "60ce169cfbae7470a7ef3313512c4454",
          "session_id": "02e86ff7ad1a9106cf42bc66f88bd15d"
        },
        "missing": [],
        "observation_id": "13b545c9156d3daafa8c9864671f529f",
        "op": "MODEL_CALL",
        "outcome": {
          "status": "success"
        },
        "precision": "exact",
        "provenance": {
          "captured_at": "2026-10-11T11:00:30Z",
          "source_event_id": "526eec15b2d278c1660bdaff190d4291",
          "transformations": [
            {
              "step": "normalize",
              "tool": "hint-cli",
              "version": "0.1.0"
            },
            {
              "step": "redact",
              "tool": "hint-cli",
              "version": "0.1.0"
            }
          ]
        },
        "request_kind": "primary",
        "source": "plugin",
        "source_id": "6e26add502e72b3782263f6399adabe6",
        "time": {
          "clock": "agent",
          "end": "2026-10-11T11:00:01Z",
          "start": "2026-10-11T11:00:01Z"
        }
      },
      {
        "class": "observation",
        "correlation": {
          "call_ref": "60ce169cfbae7470a7ef3313512c4454",
          "session_id": "02e86ff7ad1a9106cf42bc66f88bd15d"
        },
        "missing": [],
        "observation_id": "bf0fdbd59c762fb9149d1ac3160f8504",
        "op": "USAGE",
        "outcome": {
          "status": "success"
        },
        "precision": "exact",
        "provenance": {
          "captured_at": "2026-10-11T11:00:30Z",
          "source_event_id": "f34253bcfe07c60bcfc1179dc4a77cbf",
          "transformations": [
            {
              "step": "normalize",
              "tool": "hint-cli",
              "version": "0.1.0"
            },
            {
              "step": "redact",
              "tool": "hint-cli",
              "version": "0.1.0"
            }
          ]
        },
        "request_kind": "primary",
        "source": "plugin",
        "source_id": "6e26add502e72b3782263f6399adabe6",
        "time": {
          "clock": "agent",
          "end": "2026-10-11T11:00:03Z",
          "start": "2026-10-11T11:00:03Z"
        },
        "usage": {
          "input_tokens": {
            "method": "harness_usage",
            "precision": "exact",
            "state": "known",
            "unit": "tokens",
            "value": 5405
          },
          "output_tokens": {
            "method": "harness_usage",
            "precision": "exact",
            "state": "known",
            "unit": "tokens",
            "value": 165
          },
          "reasoning_tokens": {
            "reason": "not_supported",
            "state": "unknown",
            "unit": "tokens"
          }
        }
      },
      {
        "class": "observation",
        "correlation": {
          "session_id": "02e86ff7ad1a9106cf42bc66f88bd15d"
        },
        "missing": [],
        "observation_id": "370cc8ce0bfc29b9d6bfc9d2c35926ab",
        "op": "MODEL_CALL",
        "outcome": {
          "status": "success"
        },
        "precision": "exact",
        "provenance": {
          "captured_at": "2026-10-11T11:00:30Z",
          "source_event_id": "e43f92166b629f1d3a06c54dcc671962",
          "transformations": [
            {
              "step": "normalize",
              "tool": "hint-cli",
              "version": "0.1.0"
            },
            {
              "step": "redact",
              "tool": "hint-cli",
              "version": "0.1.0"
            }
          ]
        },
        "request_kind": "title",
        "source": "plugin",
        "source_id": "6e26add502e72b3782263f6399adabe6",
        "time": {
          "clock": "agent",
          "end": "2026-10-11T11:00:01Z",
          "start": "2026-10-11T11:00:01Z"
        }
      },
      {
        "class": "observation",
        "correlation": {
          "session_id": "02e86ff7ad1a9106cf42bc66f88bd15d"
        },
        "missing": [],
        "observation_id": "78f4dd9f063c6afe43651ed5c3bf2e3f",
        "op": "USAGE",
        "outcome": {
          "status": "success"
        },
        "precision": "exact",
        "provenance": {
          "captured_at": "2026-10-11T11:00:30Z",
          "source_event_id": "ae11380733eb842b783198612695f6fd",
          "transformations": [
            {
              "step": "normalize",
              "tool": "hint-cli",
              "version": "0.1.0"
            },
            {
              "step": "redact",
              "tool": "hint-cli",
              "version": "0.1.0"
            }
          ]
        },
        "request_kind": "title",
        "source": "plugin",
        "source_id": "6e26add502e72b3782263f6399adabe6",
        "time": {
          "clock": "agent",
          "end": "2026-10-11T11:00:02Z",
          "start": "2026-10-11T11:00:02Z"
        },
        "usage": {
          "input_tokens": {
            "method": "harness_usage",
            "precision": "exact",
            "state": "known",
            "unit": "tokens",
            "value": 686
          },
          "output_tokens": {
            "method": "harness_usage",
            "precision": "exact",
            "state": "known",
            "unit": "tokens",
            "value": 432
          },
          "reasoning_tokens": {
            "reason": "not_supported",
            "state": "unknown",
            "unit": "tokens"
          }
        }
      },
      {
        "class": "observation",
        "collection": {
          "closed_at": "2026-10-11T11:00:04Z",
          "closure": "flushed",
          "errors": {
            "method": "count_of_records",
            "precision": "exact",
            "state": "known",
            "unit": "count",
            "value": 0
          },
          "events_dropped": {
            "method": "count_of_records",
            "precision": "exact",
            "state": "known",
            "unit": "count",
            "value": 0
          },
          "lifecycle": "attached_at_start",
          "open_calls": {
            "method": "count_of_records",
            "precision": "exact",
            "state": "known",
            "unit": "count",
            "value": 0
          }
        },
        "correlation": {
          "session_id": "02e86ff7ad1a9106cf42bc66f88bd15d"
        },
        "missing": [],
        "observation_id": "58d189de93093446b97f28fb90c82198",
        "op": "SESSION",
        "outcome": {
          "status": "success"
        },
        "precision": "exact",
        "provenance": {
          "captured_at": "2026-10-11T11:00:30Z",
          "source_event_id": "8731a2ea9a7a7afed7ee6f7de8ac3605",
          "transformations": [
            {
              "step": "normalize",
              "tool": "hint-cli",
              "version": "0.1.0"
            },
            {
              "step": "redact",
              "tool": "hint-cli",
              "version": "0.1.0"
            }
          ]
        },
        "source": "plugin",
        "source_id": "6e26add502e72b3782263f6399adabe6",
        "time": {
          "clock": "agent",
          "end": "2026-10-11T11:00:04Z",
          "start": "2026-10-11T11:00:04Z"
        }
      },
      {
        "class": "observation",
        "correlation": {
          "run_ref": "ff9bcae247d65539d45e5d1b2a32c458",
          "task_family_id": "ce3abb2c055da0dbdd3292249cce798d",
          "task_id": "266efc12df1b8c59b759cc7121d444a6"
        },
        "missing": [
          "correlation.session_id",
          "correlation.turn_id"
        ],
        "model_ledger": {
          "binding": {
            "attempt_ref": "fc52a2aa5c5470b0cf99e02f60bc36e7",
            "configuration_digest": "sha256:c6ccb92795221053332a9bdae50e4de25bce4634585150d6cf77a1396aaa8725",
            "execution_ref": "b9ee9d1b2e33afbd8bf4019146e6b037",
            "origin": "project",
            "run_ref": "ff9bcae247d65539d45e5d1b2a32c458",
            "task_family_id": "ce3abb2c055da0dbdd3292249cce798d",
            "task_id": "266efc12df1b8c59b759cc7121d444a6",
            "unit_ref": "a32b38726bdb45e3c9d019072dbdd119"
          },
          "bypass": "enforced",
          "component_coverage": {
            "cached": 2,
            "completion": 2,
            "prompt": 2,
            "reasoning": 0
          },
          "components": {
            "cached": 4800,
            "completion": 597,
            "prompt": 6091,
            "reasoning": null
          },
          "counts": {
            "admitted": 2,
            "cancelled": 0,
            "complete": 2,
            "error": 0,